Name,Description,Price,Category
Water,Refreshing purified water,1000.50,Beverage
Caesar Salad,Fresh romaine lettuce croutons Parmesan cheese and Caesar dressing,18000.95,Starter
Grilled Salmon,Fresh Atlantic salmon fillet grilled to perfection,19000.99,Main Course
Cheesecake,Creamy New York style cheesecake with strawberry topping,6000.50,Dessert
Orange Juice,Freshly squeezed orange juice,3000.75,Beverage
Garlic Bread,Toasted baguette slices with garlic butter,5000.25,Starter
Chocolate Brownie,Rich and gooey chocolate brownie with vanilla ice cream,7000.25,Dessert